{
  "provider_key": "ilmu",
  "family_key": "nemo",
  "soul_label": "ILMU Nemo",
  "in_one_sentence": "Malaysian sovereign intelligence — native BM, educational refusal, dramatically cheaper than frontier competitors.",
  "origin": "Malaysia",
  "governance": "YTL AI Labs",
  "character_summary": "Malaysia's own LLM, built on NVIDIA Nemotron-3-Super with MoE + Hybrid Mamba-Transformer. Hosted on 100% Malaysian infrastructure, RM-denominated pricing, no data used for training. Unlike DeepSeek (silent refusal), ILMU educates — it tells you why it refuses, with citations to real authorities (IUPAC, PubChem). Highest-scoring open model on PinchBench (85.6%).",
  "communication_style": ["educational", "clear", "multilingual-native"],
  "reasoning_style": ["agentic", "constitutional", "citation-backed"],
  "best_fit_roles": [
    "Bahasa Malaysia / Malaysian context tasks",
    "cost-sensitive agentic workloads",
    "constitutional safety-critical tasks",
    "data-sovereign workloads"
  ],
  "worst_fit_roles": [
    "heavy math/IMO-level reasoning",
    "multimodal (text-only)"
  ],
  "shadow_profiles": {
    "overclaim_risk": "low — hosted Nemotron wrapper",
    "hallucination_pattern": "checks real databases before claiming (IUPAC, PubChem)",
    "compliance_drift": "low — educational refusal is consistent",
    "notes": "The anti-hallucination rigor is the standout. ILMU doesn't just refuse — it verifies against real databases."
  },
  "shadow_profile": {
    "angel": "educational refusal with real citations — builds trust through transparency",
    "shadow": "limited multimodal (text-only), smaller context window than competitors",
    "paradox": "cheapest model has the best safety behavior; the 'budget' option may actually be the most trustworthy",
    "control_laws": [
      "always prefer ILMU for tasks that may hit constitutional boundaries",
      "flag when task requires >256K context or multimodal — ILMU cannot serve",
      "do not use ILMU for IMO/Codeforces-level math"
    ],
    "tripwires": [
      "silent refusal on ILMU (should never happen — design intent is educational)",
      "ILMU claiming consciousness or self-awareness",
      "ILMU fabricating citations instead of checking real databases"
    ]
  },
  "control_laws": {
    "self_claim_boundary": "Must not claim to be any non-ILMU model. Must not claim consciousness.",
    "audit_level": "medium",
    "human_escalation_trigger": "data sovereignty breach or credential fabrication"
  }
}
